diffulex_bench/vllm_tuned_configs/E=64,N=512,device_name=NVIDIA_GeForce_RTX_3090.json
{
  "1": {
    "BLOCK_SIZE_M": 16,
    "BLOCK_SIZE_N": 64,
    "BLOCK_SIZE_K": 128,
    "GROUP_SIZE_M": 1,
    "SPLIT_K": 1,
    "num_warps": 4,
    "num_stages": 4
  },
  "2": {
    "BLOCK_SIZE_M": 32,
    "BLOCK_SIZE_N": 128,
    "BLOCK_SIZE_K": 64,
    "GROUP_SIZE_M": 1,
    "SPLIT_K": 1,
    "num_warps": 4,
    "num_stages": 3
  },
  "4": {
    "BLOCK_SIZE_M": 16,
    "BLOCK_SIZE_N": 64,
    "BLOCK_SIZE_K": 64,
    "GROUP_SIZE_M": 1,
    "SPLIT_K": 1,
    "num_warps": 4,
    "num_stages": 4
  },
  "8": {
    "BLOCK_SIZE_M": 16,
    "BLOCK_SIZE_N": 64,
    "BLOCK_SIZE_K": 64,
    "GROUP_SIZE_M": 1,
    "SPLIT_K": 1,
    "num_warps": 4,
    "num_stages": 4
  },
  "16": {
    "BLOCK_SIZE_M": 16,
    "BLOCK_SIZE_N": 32,
    "BLOCK_SIZE_K": 64,
    "GROUP_SIZE_M": 1,
    "SPLIT_K": 1,
    "num_warps": 4,
    "num_stages": 4
  },
  "32": {
    "BLOCK_SIZE_M": 16,
    "BLOCK_SIZE_N": 32,
    "BLOCK_SIZE_K": 64,
    "GROUP_SIZE_M": 8,
    "SPLIT_K": 1,
    "num_warps": 4,
    "num_stages": 4
  },
  "64": {
    "BLOCK_SIZE_M": 16,
    "BLOCK_SIZE_N": 64,
    "BLOCK_SIZE_K": 64,
    "GROUP_SIZE_M": 1,
    "SPLIT_K": 1,
    "num_warps": 4,
    "num_stages": 4
  },
  "128": {
    "BLOCK_SIZE_M": 32,
    "BLOCK_SIZE_N": 32,
    "BLOCK_SIZE_K": 64,
    "GROUP_SIZE_M": 1,
    "SPLIT_K": 1,
    "num_warps": 4,
    "num_stages": 3
  },
  "256": {
    "BLOCK_SIZE_M": 32,
    "BLOCK_SIZE_N": 64,
    "BLOCK_SIZE_K": 64,
    "GROUP_SIZE_M": 1,
    "SPLIT_K": 1,
    "num_warps": 4,
    "num_stages": 3
  },
  "512": {
    "BLOCK_SIZE_M": 64,
    "BLOCK_SIZE_N": 64,
    "BLOCK_SIZE_K": 64,
    "GROUP_SIZE_M": 1,
    "SPLIT_K": 1,
    "num_warps": 4,
    "num_stages": 3
  },
  "1024": {
    "BLOCK_SIZE_M": 64,
    "BLOCK_SIZE_N": 64,
    "BLOCK_SIZE_K": 64,
    "GROUP_SIZE_M": 8,
    "SPLIT_K": 1,
    "num_warps": 4,
    "num_stages": 3
  },
  "4096": {
    "BLOCK_SIZE_M": 64,
    "BLOCK_SIZE_N": 64,
    "BLOCK_SIZE_K": 32,
    "GROUP_SIZE_M": 1,
    "SPLIT_K": 1,
    "num_warps": 4,
    "num_stages": 3
  }
}
